<?xml version="1.0" encoding="utf-8"?>
<GrouterConfig name="grouter"
               xmlns="http://grouter.org/config.xsd"
               xmlns:xsi="http://www.w3.org/2001/XMLSchema-instance"
               xsi:schemaLocation="http://grouter.org/config.xsd ../../../../common/cmn-configbeans/src/xsd/config.xsd"
               xsi:noNamespaceSchemaLocation="../../../../common/cmn-configbeans/src/xsd/config.xsd">
    <GlobalSettings>
        <ArchiveHandler>
            <!--xs:enumeration value="Every 10 seconds@0/10 * * * * ?"/>
    <xs:enumeration value="Every 10 minutes@* 0/10 * * * ?"/>
    <xs:enumeration value="Every 30 seconds@* 0/30 * * * ?"/>
    <xs:enumeration value="Every 1 minute@0 0 * * * ?"/>
    <xs:enumeration value="Every 60 minutes@* 1 * * * ?"/>
    <xs:enumeration value="Every 10 minutes@0/10 * * * * ?"/-->
            <CronJob>Every 10 minutes@0 0 0-23 * * ?</CronJob>
        </ArchiveHandler>
        <Email sendintervallInMilliSeconds="10000">
            <smtp>
                <smtpserver id="1">mailserverl</smtpserver>
                <smtpserver id="2">mailserver2</smtpserver>
            </smtp>
            <pop>
                <popserver id="1">mailserverl</popserver>
                <popserver id="2">mailserver2</popserver>
            </pop>
            <imap>
                <imapserver id="1">mailserverl</imapserver>
                <imapserver id="2">mailserver2</imapserver>
            </imap>
        </Email>
    </GlobalSettings>

    <Node type="file-file" id="filetest-filetest" createuniquename="true" useRelativeRootpath="false">
        <inFolderConfig>
            <inFolderPath>in</inFolderPath>
            <pollIntervallMilliSeconds>5000</pollIntervallMilliSeconds>
            <skipFirstblankline>false</skipFirstblankline>
            <batchReadConfig isBatchOn="false">
                <batchSize>10</batchSize>
                <batchThreshold>10</batchThreshold>
            </batchReadConfig>
        </inFolderConfig>
        <outFolderConfig>
            <outFolderPath>out</outFolderPath>
        </outFolderConfig>
        <backup backupHandlerOn="true" archiveroOn="true">
            <backupFolderPath>backup/</backupFolderPath>
            <archiveFolderPath>archived/</archiveFolderPath>
        </backup>
        <transform transformOn="false"/>
        <error errorHandlerOn="true">
            <errorFolderPath>error/</errorFolderPath>
            <errorInFolderPath>error_info</errorInFolderPath>
            <sortOnResend>false</sortOnResend>
            <CronJob>Every minute@0/20 * * * * ?</CronJob>
            <errorNotification errorNotificationOn="true">
                <notifyEveryIntervallInMilliSeconds>180000</notifyEveryIntervallInMilliSeconds>
                <numberOfErrors>1</numberOfErrors>
                <emailNotification>
                    <emailOnFailure>/template/emailerrornotification.xml</emailOnFailure>
                </emailNotification>
                <sms>
                    <smsOnFailure>/template/down.xml</smsOnFailure>
                    <smsService>/in</smsService>
                </sms>
            </errorNotification>
        </error>
        <inactivity inactivityOn="false">
            <maxInactivityPeriodInMilliSeconds>120000</maxInactivityPeriodInMilliSeconds>
            <emailOnInactivity>/template/erroronincativity.xml</emailOnInactivity>
        </inactivity>
        <!--applicationlogger>
            <appender type="RollingFileAppender">
                <maxfilesize>100KB</maxfilesize>
                <maxbackupindex>10</maxbackupindex>
            </appender>
            <logpattern>%d{yyyy-MM-dd HH:mm:ss};%p;%t;%x;%m;%n</logpattern>
            <logfolderpath>/log</logfolderpath>
            <loglevel>DEBUG</loglevel>
        </applicationlogger>
        <messagelogger>
            <appender type="DailyRollingFileAppender">
                <rollingschedule>'.'yyyy-MM-dd-a</rollingschedule>
            </appender>
            <logpattern>%d{yyyy-MM-dd HH:mm:ss};%p;%t;%x;%m;%n</logpattern>
            <logfolderpath>/log</logfolderpath>
            <loglevel>DEBUG</loglevel>
        </messagelogger-->
    </Node>
</GrouterConfig>
